{
  "schemaVersion": 1,
  "baseCurrency": "USD",
  "providerId": "ecb",
  "note": "Every currency below is published in the European Central Bank euro foreign exchange reference rate set. USD is the base of this calculator and is derived from the ECB USD/EUR series. A currency is listed here only if the configured provider actually publishes it daily. BGN was removed on 2026-08-17 because the ECB stopped publishing it after 2025-12-31; claiming support for a rate the provider no longer supplies would be dishonest.",
  "currencies": [
    { "code": "USD", "name": "US dollar", "minorUnits": 2, "isBase": true },
    { "code": "EUR", "name": "Euro", "minorUnits": 2, "isBase": false },
    { "code": "GBP", "name": "Pound sterling", "minorUnits": 2, "isBase": false },
    { "code": "CAD", "name": "Canadian dollar", "minorUnits": 2, "isBase": false },
    { "code": "AUD", "name": "Australian dollar", "minorUnits": 2, "isBase": false },
    { "code": "NZD", "name": "New Zealand dollar", "minorUnits": 2, "isBase": false },
    { "code": "JPY", "name": "Japanese yen", "minorUnits": 0, "isBase": false },
    { "code": "CHF", "name": "Swiss franc", "minorUnits": 2, "isBase": false },
    { "code": "SEK", "name": "Swedish krona", "minorUnits": 2, "isBase": false },
    { "code": "NOK", "name": "Norwegian krone", "minorUnits": 2, "isBase": false },
    { "code": "DKK", "name": "Danish krone", "minorUnits": 2, "isBase": false },
    { "code": "PLN", "name": "Polish zloty", "minorUnits": 2, "isBase": false },
    { "code": "CZK", "name": "Czech koruna", "minorUnits": 2, "isBase": false },
    { "code": "HUF", "name": "Hungarian forint", "minorUnits": 2, "isBase": false },
    { "code": "RON", "name": "Romanian leu", "minorUnits": 2, "isBase": false },
    { "code": "ISK", "name": "Icelandic krona", "minorUnits": 0, "isBase": false },
    { "code": "TRY", "name": "Turkish lira", "minorUnits": 2, "isBase": false },
    { "code": "BRL", "name": "Brazilian real", "minorUnits": 2, "isBase": false },
    { "code": "MXN", "name": "Mexican peso", "minorUnits": 2, "isBase": false },
    { "code": "INR", "name": "Indian rupee", "minorUnits": 2, "isBase": false },
    { "code": "IDR", "name": "Indonesian rupiah", "minorUnits": 2, "isBase": false },
    { "code": "MYR", "name": "Malaysian ringgit", "minorUnits": 2, "isBase": false },
    { "code": "PHP", "name": "Philippine peso", "minorUnits": 2, "isBase": false },
    { "code": "SGD", "name": "Singapore dollar", "minorUnits": 2, "isBase": false },
    { "code": "HKD", "name": "Hong Kong dollar", "minorUnits": 2, "isBase": false },
    { "code": "KRW", "name": "South Korean won", "minorUnits": 0, "isBase": false },
    { "code": "CNY", "name": "Chinese yuan renminbi", "minorUnits": 2, "isBase": false },
    { "code": "THB", "name": "Thai baht", "minorUnits": 2, "isBase": false },
    { "code": "ILS", "name": "Israeli shekel", "minorUnits": 2, "isBase": false },
    { "code": "ZAR", "name": "South African rand", "minorUnits": 2, "isBase": false }
  ]
}
